A1: Hotel Puccini, Koningsstraat 294, Brussel.
A3: Vraag prijs gebouw Euro 1,1M ingevuld Euro 1,4M.
A5: aantal m² | B5: 2000 | E5: 2000 | H5: 2000
A7: Kosten | B7: per m² | C7: totaal | E7: per m² | F7: totaal | H7: per m² | I7: totaal
A8: aankoop kosten gebouw | B8: 700 | C8: =PRODUCT(B8,B5) -> 1400000 | E8: 700 | F8: =PRODUCT(E8,E5) -> 1400000 | H8: 700 | I8: =PRODUCT(H8,H5) -> 1400000
A9: renovatie gevel+ interieur | B9: 400 | C9: =PRODUCT(B9,B5) -> 800000 | E9: 400 | F9: =PRODUCT(E9,E5) -> 800000 | H9: 400 | I9: =PRODUCT(H9,H5) -> 800000
A10: inrichting | B10: 100 | C10: =PRODUCT(B10,B5) -> 200000 | E10: 100 | F10: =PRODUCT(E10,E5) -> 200000 | H10: 100 | I10: =PRODUCT(H10,H5) -> 200000
A13: totaal kosten gebouw+renovatie | B13: =SUM(B8:B12) -> 1200 | C13: =SUM(C8:C12) -> 2400000 | E13: =SUM(E8:E12) -> 1200 | F13: =SUM(F8:F12) -> 2400000 | H13: =SUM(H8:H12) -> 1200 | I13: =SUM(I8:I12) -> 2400000
A17: Inkomen uit verhuur | B17: =B7 -> per m² | C17: =C7 -> totaal | E17: =E7 -> per m² | F17: =F7 -> totaal | H17: =H7 -> per m² | I17: =I7 -> totaal
A19: verhuur appartementen per week | B19: 5 | C19: =PRODUCT(B19,B5) -> 10000 | E19: 7.5 | F19: =PRODUCT(E19,E5) -> 15000 | H19: 10 | I19: =PRODUCT(H19,H5) -> 20000
A20: bezettingsgraad | B20: 0.95 | C20: 0.95 | E20: 0.85 | F20: 0.85 | H20: 0.7 | I20: 0.7
A21: per maand | B21: =PRODUCT(B19,B20,52/12) -> 20.583333333333332 | C21: =PRODUCT(C19,C20,52/12) -> 41166.666666666664 | E21: =PRODUCT(E19,E20,52/12) -> 27.625 | F21: =PRODUCT(F19,F20,52/12) -> 55250 | H21: =PRODUCT(H19,H20,52/12) -> 30.333333333333332 | I21: =PRODUCT(I19,I20,52/12) -> 60666.666666666664
A22: per jaar | B22: =PRODUCT(B19,B20,52) -> 247 | C22: =PRODUCT(C19,C20,52) -> 494000 | E22: =PRODUCT(E19,E20,52) -> 331.5 | F22: =PRODUCT(F19,F20,52) -> 663000 | H22: =PRODUCT(H19,H20,52) -> 364 | I22: =PRODUCT(I19,I20,52) -> 728000
A24: Jaarlijks kosten gebouw:
A25: onroerend goed belasting | C25: 30000 | F25: 30000 | I25: 30000
A26: energie | C26: 25000 | F26: 25000 | I26: 25000
A27: beheer | C27: 20000 | F27: 20000 | I27: 20000
A28: beveiliging | C28: 50000 | F28: 50000 | I28: 50000
A30: totaal jaarlijkse kosten | C30: =SUM(C25:C29) -> 125000 | F30: =SUM(F25:F29) -> 125000 | I30: =SUM(I25:I29) -> 125000
A32: Baten per jaar | C32: =SUM(-C30,C22) -> 369000 | F32: =SUM(-F30,F22) -> 538000 | I32: =SUM(-I30,I22) -> 603000
A34: Waarde verhuurd gebouw 10x baten | C34: =PRODUCT(C32,10) -> 3690000 | F34: =PRODUCT(F32,10) -> 5380000 | I34: =PRODUCT(I32,10) -> 6030000
A36: =A13 -> totaal kosten gebouw+renovatie | B36: =B13 -> 1200 | C36: =C13 -> 2400000 | E36: =E13 -> 1200 | F36: =F13 -> 2400000 | H36: =H13 -> 1200 | I36: =I13 -> 2400000
A38: Toegevoegde waarde | C38: =SUM(C34,-C36) -> 1290000 | F38: =SUM(F34,-F36) -> 2980000 | I38: =SUM(I34,-I36) -> 3630000